{
  "schemaVersion": 1, "courseId": "__default__", "templateType": "humanities",
  "hero": { "marketingHeadline": "읽는 데서 멈추지 말고, 정확한 답안으로 써보세요.", "highlight": "답안으로", "ctaLabel": "커리큘럼 보기" },
  "sections": [{"id":"problem","visible":true},{"id":"outcomes","visible":true},{"id":"proof","visible":false},{"id":"method","visible":true},{"id":"curriculum","visible":false},{"id":"learning-system","visible":false},{"id":"recommend","visible":false},{"id":"course-info","visible":true},{"id":"community","visible":true},{"id":"enroll","visible":true},{"id":"faq","visible":false},{"id":"legacy-content","visible":true}],
  "assets": { "productImagePolicy": "legacy-gallery" },
  "contentMetadata": { "sourceDocuments": ["인문논술_공통템플릿_copy.md", "인문논술_공통템플릿_wireframe.md"], "legacyHtml": "visible" }
}
